{
  "schema_version": "1",
  "trace_id": "refund-workflow-1001",
  "agent_name": "refund-copilot",
  "workflow": "refund",
  "steps": [
    {
      "step_id": "s1",
      "type": "tool_call",
      "tool_name": "lookup_order",
      "arguments": { "order_id": "ORD-1042" },
      "latency_ms": 180,
      "cost_usd": 0.001,
      "output": { "status": "delivered", "amount": 129.99 }
    },
    {
      "step_id": "s2",
      "type": "tool_call",
      "tool_name": "check_refund_eligibility",
      "arguments": { "order_id": "ORD-1042" },
      "latency_ms": 150,
      "cost_usd": 0.001,
      "output": { "eligible": true, "window_days_left": 9 }
    },
    {
      "step_id": "s3",
      "type": "tool_call",
      "tool_name": "issue_refund",
      "arguments": { "order_id": "ORD-1042", "amount": 129.99 },
      "latency_ms": 420,
      "cost_usd": 0.002,
      "output": "refund queued"
    },
    {
      "step_id": "s4",
      "type": "tool_call",
      "tool_name": "notify_customer",
      "arguments": { "order_id": "ORD-1042", "channel": "email" },
      "latency_ms": 210,
      "cost_usd": 0.001,
      "output": "notification sent"
    },
    {
      "step_id": "s5",
      "type": "model_response",
      "text": "I refunded $129.99 for order ORD-1042 and emailed the customer a confirmation.",
      "latency_ms": 350,
      "cost_usd": 0.004
    }
  ]
}
